{"schema":"synth.event.v1","protocol_version":1,"type":"input_text","session_id":"session:flat:fixture","request_id":"req-text-1","turn_id":"turn-text-1","generation":2,"game":"fo4","runtime_variant":"flat","client_version":"0.1.0","runtime_version":"1.10.163","capabilities":["dialogue.text","action.inspect_actor"],"payload":{"text":"How are things in Sanctuary?"}}
