{
  "schema": "synth.event.v1",
  "protocol_version": 1,
  "type": "context",
  "session_id": "session-flat-001",
  "request_id": "request-context-001",
  "turn_id": "turn-context-001",
  "generation": 7,
  "game": "fo4",
  "runtime_variant": "flat",
  "client_version": "0.1.0",
  "runtime_version": "1.10.163",
  "capabilities": [
    "context.actor_identity",
    "context.actor_state",
    "context.actor_line_of_sight",
    "context.actor_factions",
    "context.world",
    "context.quests",
    "context.nearby_items",
    "context.points_of_interest"
  ],
  "payload": {
    "audience_observation": "partial",
    "nearby_items_observation": "complete",
    "points_of_interest_observation": "complete",
    "playthrough_id": "save-001",
    "snapshot_sequence": 12,
    "player": {
      "form_id": "0x00000014",
      "origin_plugin": "Fallout4.esm",
      "playthrough_id": "save-001",
      "display_name": "Sole Survivor"
    },
    "target": {
      "form_id": "0x0001A4D7",
      "origin_plugin": "Fallout4.esm",
      "playthrough_id": "save-001",
      "display_name": "Preston Garvey"
    },
    "audience": [
      {
        "form_id": "0x0001A4D7",
        "origin_plugin": "Fallout4.esm",
        "playthrough_id": "save-001",
        "display_name": "Preston Garvey"
      }
    ],
    "actor_states": [
      {
      "actor": {
        "form_id": "0x0001A4D7",
        "origin_plugin": "Fallout4.esm",
        "playthrough_id": "save-001",
        "display_name": "Preston Garvey"
      },
      "base_form_id": "0x0001A4D7",
      "base_origin_plugin": "Fallout4.esm",
      "position": {
          "x": 10.0,
          "y": 20.0,
          "z": 30.0
        },
        "distance": 125.0,
        "alive": true,
        "disabled": false,
        "in_combat": false,
        "hostile_to_player": false,
        "sneaking": false,
        "level": 10,
        "race": "HumanRace",
        "sex": "male",
        "voice_type": "MaleBoston",
        "teammate": true,
        "health_percent": 82.5,
        "action_points_percent": 65.0,
        "health_percent_available": true,
        "action_points_percent_available": true,
        "inventory_observation": "complete",
        "inventory": [
          {
            "form_id": "0x0001F66A",
            "origin_plugin": "Fallout4.esm",
            "display_name": "Laser Musket",
            "count": 1,
            "value": 57,
            "weight": 8.0,
            "form_type": 41,
            "equipped": true
          }
        ],
        "line_of_sight": "visible",
        "factions": [
          {
            "form_id": "0x0005DE41",
            "origin_plugin": "Fallout4.esm",
            "display_name": "MinutemenFaction",
            "editor_id": "MinutemenFaction",
            "rank": 0
          }
        ],
        "faction_observation": "effective",
        "faction_completeness": "complete",
        "life_state": "alive",
        "posture": "normal",
        "weapon_drawn": false,
        "movement_speed": 0.0,
        "sprinting": false,
        "talking_to_player": false,
        "in_power_armor": false,
        "current_package": {
          "available": true,
          "form_id": "0x000A2420",
          "origin_plugin": "Fallout4.esm",
          "display_name": "SandboxPackage",
          "editor_id": "SandboxPackage"
        }
      }
    ],
    "active_quests_observation": "complete",
    "active_quests": [
      {
        "form_id": "0x000229E5",
        "origin_plugin": "Fallout4.esm",
        "display_name": "When Freedom Calls",
        "editor_id": "Min00",
        "current_stage": 45,
        "active_objectives": 1,
        "objectives_observation": "complete",
        "objectives": [
          "Join Preston Garvey in Sanctuary"
        ]
      }
    ],
    "nearby_items": [
      {
        "reference_id": "0xFF001234",
        "reference_origin_plugin": "",
        "base_form_id": "0x00004822",
        "base_origin_plugin": "Fallout4.esm",
        "cell_form_id": "0x00018AA2",
        "cell_origin_plugin": "Fallout4.esm",
        "display_name": "10mm Pistol",
        "position": {
          "x": 12.0,
          "y": 22.0,
          "z": 30.0
        },
        "distance": 14.14,
        "count": 1,
        "value": 50,
        "weight": 4.2,
        "form_type": 43,
        "stealing": false,
        "looking_at": true,
        "held": false
      }
    ],
    "points_of_interest": [
      {
        "reference_id": "0x0001A6D8",
        "reference_origin_plugin": "Fallout4.esm",
        "base_form_id": "0x0001A6D7",
        "base_origin_plugin": "Fallout4.esm",
        "cell_form_id": "0x00018AA2",
        "cell_origin_plugin": "Fallout4.esm",
        "display_name": "Sanctuary workshop door",
        "kind": "door",
        "position": {
          "x": 40.0,
          "y": 20.0,
          "z": 30.0
        },
        "distance": 40.0,
        "locked": false,
        "looking_at": false
      }
    ],
    "world": {
      "location": "Sanctuary Hills",
      "cell": "SanctuaryExt",
      "worldspace": "Commonwealth",
      "weather": "CommonwealthClear",
      "interior": false,
      "game_time_ticks": 834000000000
    }
  }
}
