{"schema":"synth.event.v1","protocol_version":1,"type":"activate","session_id":"session:flat:fixture","request_id":"activate:7:4","turn_id":"turn:7:5","generation":7,"game":"fo4","runtime_variant":"flat","client_version":"0.1.0","runtime_version":"1.11.240","capabilities":["agents.manage","context.actor_identity"],"payload":{"actor":{"form_id":"0x0001A4D7","origin_plugin":"Fallout4.esm","playthrough_id":"save:fo4:001","display_name":"Preston Garvey"},"source":"manual"}}
