{"schema":"synth.event.v1","protocol_version":1,"type":"action_result","session_id":"session:flat:fixture","request_id":"req-action-result-1","turn_id":"turn-text-1","generation":2,"game":"fo4","runtime_variant":"flat","client_version":"0.1.0","runtime_version":"1.10.163","capabilities":["dialogue.text","action.inspect_actor"],"payload":{"result":{"schema":"synth.action.result.v1","action_id":"action-1","idempotency_key":"idem-action-1","status":"succeeded","detail":"Actor is present in the current snapshot."}}}
