{"schema":"synth.event.v1","protocol_version":1,"type":"trigger","session_id":"session-flat-001","request_id":"request-combat-001","turn_id":"turn-combat-001","generation":7,"game":"fo4","runtime_variant":"flat","client_version":"0.1.0","runtime_version":"1.10.163","capabilities":["dialogue.text"],"payload":{"kind":"combat_bark","actor":{"form_id":"0x0001A4D7","origin_plugin":"Fallout4.esm","playthrough_id":"save-001","display_name":"Preston Garvey"}}}
