{"schema":"synth.event.v1","protocol_version":1,"type":"init","session_id":"session:flat:fixture","request_id":"req-init-flat-1","turn_id":"turn-init-flat-1","generation":1,"game":"fo4","runtime_variant":"flat","client_version":"0.1.0","runtime_version":"1.10.163","capabilities":["dialogue.text","context.loaded_plugins","action.inspect_actor"],"payload":{"locale":"en-US","plugins":[{"plugin_name":"Fallout4.esm","is_light":false,"compile_index":0,"small_file_compile_index":0,"partial_index":0,"formid_prefix":"00"}]}}
